{
  "schemaVersion": "1.0.0",
  "corpusId": "repository-interviews-v1",
  "candidateIds": [
    "audit-vector",
    "audit-winston",
    "audit-bunyan",
    "audit-datadog-trace-js",
    "audit-npm-npmlog",
    "audit-logdna-logger",
    "auth-open-policy-agent",
    "auth-cerbos-cerbos",
    "auth-stalniy-casl",
    "auth-auth0-node-jsonwebtoken",
    "auth-warrant",
    "auth-casbin-casbin",
    "jobs-dagster",
    "jobs-graphile-worker",
    "jobs-node-cron",
    "jobs-p-queue",
    "jobs-kue",
    "jobs-temporal-typescript",
    "rate-apisix",
    "rate-envoy-ratelimit",
    "rate-bottleneck",
    "rate-caddy",
    "rate-kong",
    "rate-redis-cell",
    "webhook-hookdeck",
    "webhook-standard-webhooks",
    "webhook-octokit-methods",
    "webhook-clerk-javascript",
    "webhook-webhook-site",
    "webhook-adnanh"
  ],
  "calibrationCandidateIds": [
    "auth-warrant",
    "audit-datadog-trace-js",
    "jobs-node-cron",
    "jobs-dagster",
    "rate-redis-cell",
    "webhook-hookdeck"
  ],
  "requiredCounts": {
    "candidates": 30,
    "candidatesPerFamily": 6,
    "negativeControls": 5,
    "negativeControlsPerFamily": 1,
    "archived": 3,
    "moved": 2,
    "richAdditionalDocumentation": 12,
    "readmeOnly": 18
  },
  "lifecycleDiversityScope": "cohort"
}
